{
  "version": "2.0",
  "updated_at": "2026-06-21T15:00:00Z",
  "ttl_seconds": 86400,
  "expires_at": "2026-06-22T15:00:00Z",
  "html": "<!DOCTYPE html><html lang=\"en\"><head><meta charset=\"utf-8\"><meta name=\"viewport\" content=\"width=device-width,initial-scale=1\"><meta name=\"description\" content=\"Galaxy S25 Ultra 상세 정보.\"><link rel=\"canonical\" href=\"https://www.samsung.com/uk/smartphones/galaxy-s25\"><script type=\"application/ld+json\">{\"@context\":\"https://schema.org\",\"@type\":\"Product\",\"name\":\"Galaxy S25 Ultra\"}</script></head><body><section><article><h1>Galaxy S25 Ultra</h1><p>최첨단 AI 기능을 탑재한 플래그십 스마트폰</p></article></section></body></html>"
}